ID,Question,A,B,C,D
98,How can partnering with the local wastewater utility benefit a thermal energy from wastewater project?,Expand project scope,Generate cost-sharing opportunities,Increase bureaucratic delays,Extend projected timelines
99,What must be considered to address regulatory barriers in implementing modern heating systems such as district energy system (DES) and district heating (DH)?,"Understanding and, if necessary, addressing technical and governance issues",Building new infrastructure and partnering with international companies,Acquiring more funding,Increasing public awareness
100,What are the primary factors to consider in the business models for thermal energy from wastewater systems?,"Marketing strategies, operational costs, and customer satisfaction","Innovation, technological advancements, and research development","Financing, partnering requirements, and authority to bill customers","Efficiency, renewable energy sources, and public partnership programs"
101,What external electron donor is commonly applied to support denitrification in wastewater treatment?,Propane,Ethanol,Methanol,Hydrogen
102,Which process is used to disinfect the secondary effluent and is also effective for destroying trace levels of emerging contaminants?,reverse osmosis,UV radiation,chlorination,ozonation
103,What recent technological advancements have intensified data-driven modeling in water treatment systems?,The decrease in the expense of data collection and storage.,The expansion of advanced models.,The development of advanced microbial testing methods.,The increase in the availability of chemical sensors.
104,"What sampling method is described as providing analysis results that are independent of flow and represent a time-weighted, arithmetic average?",In-line sampling,Flow-composite sampling,Event-based sampling,Time-composite sampling
105,"Which type of sample provides analysis results representative of an event-weighted, arithmetic average dependent on flow?",In-line sensors,Flow-composite,Time-composite,Time-weighted sampling
106,What aspect proves challenging with traditional modeling approaches in water treatment distribution systems?,Maintaining accurate records of maintenance and operational costs in the systems,Regularly conducting preventative maintenance,Identifying optimal pumping schedules due to the non-linear nature and multiple constraints of the systems,Ensuring continuous flow rates without considering economic implications
107,What is primarily used to maintain chemical concentration per unit volume of water in a full-scale WTP?,Flow-paced chemical dosing,Static chemical dosing,Dynamic chemical dosing,Reactive chemical dosing
108,Why is aqueous oxygen available as free oxygen (O2) critical in activated sludge systems?,It enhances the ion transfer process in the system.,It suppresses biofilm growth on instruments in the system.,"It indicates aerobic conditions, which determine the active microorganisms.",It reacts with sulfur to avoid accumulation of detrimental conditions.
109,What is the primary consequence of increasing DO setpoints in SBRs to fully oxidize chemical contaminants?,Increased labor costs,Increased energy consumption,Decreased water quality,Decreased microbial activity
110,Why are prices in the water sector often kept lower than the true cost of water?,For reasons of social equity or economic development.,To comply with international standards.,To promote water conservation.,To compete with private water providers.
111,Which resource from water resource recovery facilities can replace limited sources of phosphate fertilizers?,Recoverable nutrients,Electricity,Vast sources of recoverable heat,Organic carbon resources
112,What potential use does recoverable heat from water resource recovery facilities have beyond the perimeter of a treatment plant?,District heating,Commodity chemical production,Electricity generation,Food processing
113,What process is primarily used to recover biogas from sewage sludge?,Aerobic decomposition,Filtration,Anaerobic digestion,Combustion
114,Which type of pollutants were initially overlooked by wastewater treatment policies before being recognized as a threat?,Personal care products and pharmaceuticals,Microbial agents and fungi spores,Asphalt residues and crushed plastics,Industrial adhesives and sealants
115,What is one of the main challenges with the current water sector policies?,Policies exclude water efficiency projects.,Policies focus exclusively on protecting human health without considering the environment.,Policies are a complex web of sometimes contradictory regulations.,Policies are unanimous and consistent at all government levels.
116,Why do efforts to improve public and environmental health in the water sector sometimes negatively impact climate?,They completely neglect the use of renewable energy sources.,They increase energy and chemical use or emissions like N2O.,They rely exclusively on outdated machinery and techniques.,They prioritize public health over private investments.
117,What practical advantage is provided by reducing reliance on outside supplies for critical resources?,Eliminates the need for technological advancements,Increased ability to manage and control operating costs under variable economic conditions,Reduces the number of required employees,Ensures compliance with international regulations
118,What is a key benefit of recovering products valued by customers in the water sector?,"Eliminates all residual waste streams, bypassing disposal requirements",It provides revenue that partially offsets costs and assures management options,Ensures complete financial independence from government subsidies,Guarantees global dominance of water utilities in commodity markets
119,What is the role of regulations in the progression of water sector functions?,Preventing the establishment of new functions,Solely driving the success of water sector utilities,Promoting reliable service provision when consistently enforced,Obstructing the implementation of innovative solutions
120,What is one example of a current product extracted from the used water stream that can produce energy without fossil fuels?,Phosphorus,Nitrogen,Struvite,Biogas
121,What complicates the accurate pricing of water as a human consumption resource?,Water being controlled by private entities complicates its distribution.,Water being a human right complicates its price rarely reflecting the true cost.,Water being a luxury item complicates its affordability.,Water price usually fluctuates a lot
122,Which paradigms are being increasingly adopted by leaders in the water profession?,One Water and resource recovery paradigms,Water reuse and groundwater replenishment paradigms,Traditional water supply and socio-economic adjustment paradigms,Decarbonization and surface water paradigms
123,What is the general expectation for adaptation in the water sector given the pace of global changes?,Adaptations must be more proactive than in the past,Adaptations must emphasize traditional methods exclusively,Adaptations should focus only on retroactive responses,Adaptations should only consider historical trends
124,What lessons can urban water management learn from mass transit systems about reducing per capita GHG emissions?,Delayed upgrades follow reduced incentive alignment.,Dominance reduces alternative innovation potentials.,A skewed source diversity challenges emissions spread.,Reduction in per capita emissions is made possible by use.
125,What is a key focus for mitigating climate change within the urban wastewater sector?,Redirect wastewater processing to alternative decentral systems.,Implement modernized and fully automated treatment mechanisms.,"Quantify, model, and mitigate GHG emissions from urban systems.",Upgrade infrastructure to cope with increasing operational loads.
126,Which biogenic gases are specifically addressed as Scope 1 emissions in urban wastewater systems?,Nitrous oxide and methane,Carbon dioxide and ozone,Carbon monoxide and hydrogen sulfide,Ammonia and hydrogen
127,What is a notable reason for the environmental concern regarding N2O?,It intensifies degradation of fertile soil layers,It shows resistance to dissolving in liquid environments,Its large contribution to carbon emissions,It cannot naturally degrade over time
128,Why is the urban wastewater system engineered to decouple the human-used water and natural water environments?,To reduce declines in biodiversity and natural habitats,To ensure treated water is discharge safe,To fully guard natural waters against contaminates,To make water accessible for industrial facilities
129,What is the role of anaerobic digestion (AD) in methane generation in wastewater systems?,Separates the solid components from wastewater by processing.,Ensures increased oxygen levels in wastewater treatment systems.,"Decomposes organic materials anaerobically, producing methane and other gases.",Transforms atmospheric methane into the form of biogas emitters.
130,What is essential for GHG monitoring campaigns in terms of CH4 emissions?,Influent datasets comprehensively centralize component data.,Expanding sewer networks bolsters detection subcategories function.,Tracking emissions at fugitive levels yields critical results.,Prioritizing nitrous oxide prioritization aligns analyses.
131,What is a significant reason for the inefficiency in the last step of the denitrification process?,A majority of microorganisms lack N2O reduction capability to N2.,The intermediate compounds become entirely inert at this stage.,Temperature decreases negatively impact the reactions involved.,Oxygen absence completely hinders subsequent chemical reactions.
132,What is a condition under which abiotic N2O production becomes significant?,Less oxygen availability favors production through abiotic ways.,The presence of natural organic compounds enhances emission.,A reduced nitrogen loading rate alters the process outcomes.,An increased concentration of NO2- and NH2OH substrates.
133,What is the primary observed result when NH4+ is introduced under specific experimental conditions involving Nitrosomonas europaea?,NH4+ adjustments lead to independent NO rebound occurrences.,A rapid metabolic cessation resulting across aerobic intervals.,No emissions of nitrogen oxides are detectable overall tests.,A noted increase of N2O released during oxygen level changes.
134,Which abiotic reaction involving Fe3+ contributes to N2O production?,Reducing nitrate ions into lower states using Fe3 types.,Oxidation reactions with NH2OH catalyzed by Fe3+ molecules.,Oxidizing nitrite ions with active states involving NH2OH.,Reducing NH2OH by engaging with Fe3 converted reagents.
135,What internal carbon source is known to be stored by denitrifiers during conditions of insufficient external organic carbon?,Methane as a carbon-rich gaseous entity,Lipoids in metabolic growth activities,Peptidoglycans as structural cellular elements,Polyhydroxyalkanoates for endogenous respiration purposes
136,What copper center in NoS is responsible for accepting electrons from water-soluble electron donors?,"CuZ, identified as a quad-nucleated copper center.","ZnA, noted as a mono-nuclear zinc center.","FeS, defined as an iron-sulfur active center.","CuA, described as a binuclear copper center."
137,What component was found inhibitory to N2O reduction?,"O3, having ozone properties, is not significant.","Cl2, described as chloride gas, not relevant here.","CH4, a form of methane, lacks such inhibition.","H2S, known as hydrogen sulfide and inhibitory here."
138,What percentage of near-term climate warming is attributed to methane according to 2006 IPCC data?,Captured tenth broadly equivalent comparisons noted,Sharing levels almost three-quarters potent indeed,Contributing up to an approximate one-third findings,Responsible to about two-thirds entirely roughly estimate
139,What is the relationship between sulfide hotspots and methane concentrations?,Sulfide-rich zones indicate heightened concentration of methane gas.,Methane dynamics connect only with sulfides not liquid conditions here.,Methane shows decreasing levels near sulfide-abundant geographic zones.,Sulfide-abundant locations do not correspond with methane trends.
140,What process is primarily responsible for methane generation in anaerobic wastewater treatment?,Methanogenesis produces methane in the treatment process,Hydrolysis breaks down complex polymers into monomers,Digestion processes degrade biomaterials into simpler forms,Acetogenesis synthesizes acetate under anaerobic conditions
141,What is considered one of the biggest challenges for widespread utilization of anaerobic wastewater treatment?,Retrieving nutrients as challenges affecting wastewater plants.,Absence of established techniques for sludge stabilization.,"Managing dissolved methane emissions, reducing GHG release.",Scarcity of required resources for support of these systems.
142,Methane emissions from sludge-drying lagoons contribute what proportion of total plant GHG emissions in investigated WWTPs?,Higher unreality range source reports state around 70-90%.,Estimated 24-65% contribution to overall facility emissions.,Moderately lower total around assessed 15-35% maximum case.,Around 10-20% considered plausible estimate plant records.
143,What is a commonly practiced method for sludge stabilization in wastewater treatment plants?,Aerobic sedimentation for consistent sludge management,Activated sludge processing for overall treatment goals,Anaerobic digestion for achieving sludge stabilization,Chemical processing of sludge to treat influent waste
144,What process is identified as a substantial methane emission source in wastewater treatment plants?,Anaerobic sludge drying in wastewater treatment,Biogas desulfurization procedures conducted in WWTPs,Wet oxidation conducted for handling combustible sludge,Enhancing effluent quality through ultrafiltration methods
145,What temperature increase limit does the Paris Agreement seek to achieve?,Establishing limits of 1.5-degree increments per each decade,Reducing the temperatures to pre-industrial ambient conditions,Preventing a rise that permits a 3-degree overall increment,A global temperature increase below the level of 2 degrees
146,"Under the GHG Protocol's categorization, what defines Scope 1 emissions?",Emission sources outside owned operational purview.,Tracked emissions from energy acquisition indirectly.,Combined direct and indirect emission sources overall.,Direct emissions by sources managed or owned directly.
147,Why may the CO2 produced during biological wastewater treatment not require inclusion in certain reports?,Minimal impact industrial scales undergo from sources.,Guidelines exclude nonbiogenic sources from computations.,Policy omits calculations of human source emissions.,It qualifies as biogenic emissions not reportable therein.
148,Why might methane emissions be inadvertently released from water treatment facilities?,Excessive nitrogen utilization causes aberrant secondary effects.,Faulty recording of activity data measurements affects results.,Leaks present in tank or pipe installations lead to releases.,Mismanagement of operational temperature monitoring causes failures.
149,What type of climate zone correlates with higher N2O emissions?,Polar terrains with extreme seasonal freezing,Arid zones with low aquatic microbial presence,Tropical regions with increased bacterial activities,Coastal zones with Mediterranean influences
150,What is the method advocated by the IPCC Guidelines for determining asset-specific emissions factors (EFs)?,Measurement based on direct site-level monitoring data,Evaluation based on historical process performance data,Analysis using existing country-specific parameter data,Calculation using theoretical global average nitrogen loads
151,What major challenge is presented in creating country-specific emissions factors (EFs) according to the guidelines?,Improving computational resources for global analyses,Establishing clear nitrogen-based conversion standards,Managing variability in WWTP processes and emissions,Increasing nitrogen load data collection quality rates
152,What is the primary greenhouse gas produced in sewer systems?,H2S,Methane,CO2,O3
153,What type of sewer configuration predominantly has anaerobic conditions?,Sewers that are filled under pressure maintaining devoid oxygen areas,Fully independent parallel types might exhibit various oxygen features,Gravity sewers typically comprise aeration spots where oxygen enters,Sewer systems combining gravity and pressure maintain mixed atmospheres
154,What is a primary challenge in sampling dissolved CH4 from rising main sewers?,Managing geographical regions for optimized sample distribution,Avoiding sample contamination by exposure to atmospheric oxygen,Ensuring slow movement during the entire sampling procedures,Reducing user reliance in operational processes and sampling
155,How is the surface emission rate determined in closed flux chambers?,Calculating absorption effects for effective emission measurement data,Tracking variations in gas molecular motions under desired conditions,Surveying the flux of gases near boundaries using specialized detection,Measured by noting changes in gas concentration over given time spans
156,What operational factor should guide the placement of floating hoods?,Specifically considering reactor design and known gradients.,Matching average liquid inflow and operational heights.,Positioning near outputs or vented emission areas.,Aligning with consistent module-based system designs.
157,What assumption is critical during preliminary GHG assessment?,Sampling processes mandate continuous year-wide applications.,Exclusion from calculated KLa evaluates emission only conditions.,Considers ready standardized output emission rates directly below.,Simple grab sampling indicates a magnitude approximation well.
158,How can spatial variability in WWTP emissions be addressed effectively?,Implement varied local comprehensive sampling protocols,Avoid investigation regions sharing equal observations,Focus solely on nitrification process,Assume consistent emissions through entire operations
159,Which operational factors can trigger elevated N2O emissions in wastewater treatment plants?,High NH4+ and poor aeration control,De-aeration planned with CO2 air mix,Stable NH4+ and stretched aeration intervals,Low NH3 rates with over-aeration
160,What is the primary cause for the variability of N2O emissions in biological processes at WWTPs?,Fluctuating local climate and weather conditions,Varying biological processes and operational conditions in systems,Infrastructure age of treated water facilities,Varying local policies
161,What factor is NOT highlighted as impacting the N2O emissions variability in BNR processes?,Chemicals applied for cleaning processes in WWTP operations,Daily diurnal emission pattern variations during monitoring phases,Shifts or changes in biological processing activities observed,Infrastructure design and functioning operational configurations noted
162,Which pathway is associated with N2O emissions when NO2? and NH4+ coexist under O2-limiting conditions in aerobic compartments?,Trigger mechanism is the NH2OH oxidation pathway,Trigger mechanism is the nitrifier denitrification pathway,Reaction occurring is ammonia oxidation pathway,Involved process is heterotrophic denitrification pathway
163,What is one primary contributor to CH4 emissions from WWTPs with anaerobic sludge handling processes?,Grit Tanks,Sludge Processing,Aeration Tank,Pressurized Mains
164,What is the main CH4 emission source in WWTPs without anaerobic sludge treatment?,Bar screen,Equalization tanks,Facility office,Aeration tanks and headworks
165,What is critical for achieving complete denitrification during the mitigation of N2O emissions?,Reducing influent COD,Higher solid concentration,Exclusive use of anaerobic digestion.,Using enough COD as denitrification donor.
166,What significance does modelling have for biological nitrogen removal processes?,Replaces biology with chemical methods.,Refines and optimizes removal processing.,Generalizes all kinds of emission models.,Alters removal mechanisms.
167,Which of the following is true about the calibration of N2O modelling?,Assumes no variation in results universally.,Validated using different scale capacities available.,Utilizes hypothetical projection methods only.,Relying on lab-scale testing during model validation.
168,What experimental approach is modeled using the concept of electron carriers in denitrification?,Single-step nitrite reduction in denitrification,Limitation of carbon use in denitrification,Measuring N2O buildup using oxygen limitation,Differential electron use in four reduction stages
169,What is the primary factor contributing to the modeled electron competition in multi-resistor electric circuits?,Suspension temperature determines resistances,Saturation of oxygen has major implications,Resistance depends on concentrations of substrates,Carbon in excess modifies reduction pathways
170,What are free ammonia and free nitrous acid considered as in the nitrification process?,Oxygen substitutes these in processes involving ammonia-oxidizing steps.,"They serve as substrates in nitritation and denitritation, respectively.",They are products of denitrification by primarily heterotrophic activity.,They are catalysts active in reactions reducing nitric oxides primarily.
171,"In biofilm systems, where do substrates encounter initial resistance during diffusion?",The resistance establishes broadly across microbe layers.,Spaces between varied materials influence transportation.,Diffusion resistance occurs firstly at liquid boundaries.,Central biofilm sections present initial particle limiting.
172,What component adjustment affected the hydraulic retention time prediction in gas hold-up models?,Adjusting volumetric oxygen transfer coefficients,Monitoring ammonium concentration efficiency changes,Evaluating nitrogen load effects retention changes,Analyzing contribution of nitrite nitrogen levels
173,Which development has been undertaken in the field of methane modeling for sewers in recent years?,Unique methane modeling pathways within desert conditions enabled.,Processes creating hydrogen through methane introduction models.,Methane cases connected with aquatic vegetations modeling efforts.,Model inclusion for methane oxidation under aerobic conditions.
174,"In the sewer CH4 model, how are the biofilm-catalyzed processes represented?",Unrefined equations describing bulk activities alongside methane.,Trial process utilizing simplistic microbial activity modeling.,Non-mathematical assessment frameworks evaluating qualitative work.,Kinetic models considering substrate saturation within systems.
175,What is represented by glucose in Anaerobic Digestion Model No. 1 (ADM1)?,Glucose signifies the fermentable substrates utilized in biochemical reactions.,Glucose is utilized directly by methanogens for the energy production process.,Glucose serves as an electron donor specifically in sulfate reduction processes.,Glucose represents non-fermentable organic materials found within the sewage.
176,Why is propionate considered only as an electron donor for sulfate reduction?,Because propionate significantly contributes to sulfur dioxide emissions at microbes.,Because utilization of propionate by methanogens is not feasible in sewage.,Because the concentration of propionate in sewage systems is significantly high.,Because fermentative microbes fully consume all available propionate.
177,Which input data is generally NOT required for calibrating sewer models?,"Physical properties of sewer pipeline like size, slope, and length","Hydraulic information like flow rates, velocities, and depths",Navigational data for sewer pipeline grid locations,Environmental data like temperature
178,Which factor is key in approximating the liquid-gas transfer rate for methane stripping?,Model uses gas-phase mole fraction and pressure variations.,Reactor's retention times are factored into the model dynamics.,Calculated coefficients for anaerobic activity adjustment are used.,Ammonium stimulation is selectively considered for model formulation.
179,What does the reaction kinetics in ADM1 consider for substrate uptake rates?,Exclusive hydrogenic concentrations determine uptake completely.,Selective ammonium changes dynamically alter the uptake features.,Methane efficiency rates strictly determine all uptake velocities.,A function dependent on growing biomass concentration is assumed.
180,What major greenhouse gas has a significant impact on GHG emissions due to its 300-fold stronger greenhouse effect compared to CO2?,"Nitrous oxide (N2O), a potent greenhouse gas","Methane (CH4), a moderate greenhouse contributor","Ozone (O3), a lesser greenhouse gas variant","Nitrogen dioxide (NO2), not primarily impactful"
181,What has historically been the prime focus in the evaluation of WWTP operations?,Considering GHG reductions alongside operations,Maximizing throughput with cutting-edge methodologies,Ensuring quality water with feasible technicalities,Minimizing biological risks within treatment processes
182,Which gases does the liquid-gas phase transfer particularly consider within the activated sludge model?,Helium-enriched oxides and radiative emissions,Water-based nitrogen dioxide and sulfur dioxide,Carbonated methane and oxygen nitrides respectively,"Hydrogen monoxide, nitrogen and nitrous oxide"
183,How are GHG emissions from direct secondary treatment primarily generated?,GHG generation is specific to methane flaring procedures.,These emissions include CO2 respiration and N2O production.,Emissions are mainly composed of unburned methane through processing.,Main emissions are CH4 and some Carbon monoxide gases.
