ID,Question,A,B,C,D
184,What process is mainly responsible for emissions during sludge processing?,Methanol usage impacts denitrification as the primary process.,Post digestion with combustion outputs major gas emissions.,Sludge dehydration emits considerable levels of N2O heavily.,Anaerobic digestion produces emissions of CO2 and CH4 overall.
185,What are the implications of improving TSS clarifier efficiency with chemical additions?,Balances GHG anthropogenic continentally independent zones,Enables higher sludge retention reducing filtrate byproducts,Requires strategies programming for nitration compensations,Provides slightly stabilized quality for effluent regions maintained
186,What is the main drawback of operating a plant at low DO concentrations when considering GHG impact?,Higher N2O levels contribute extensively to total emissions.,Aeration demands elevate CO2 outputs by energy increments.,Denitrification rates counterbalance observed CO2 reductions made.,Cost-effectiveness in operations diminishes energy performance.
187,How does the hybrid modeling approach between knowledge-based AI and N2O mechanistic models benefit emission analysis?,Reduction of dependencies on DO parameters during assessment,It enables prediction and applies strategies to mitigate emissions,Enhancement of natural denitrification occurring within aquifers,Automation implementation to reduce reactor maintenance workload
188,What is essential for developing reliable process-based nitrous oxide emission factors in wastewater treatment?,Extended observation campaigns spanning at least one year.,High-energy solutions preferentially enhance outputs detected.,Offline analysis with compact comprehensive equipment.,Utilizing dynamic models refined under all parameters.
189,What combination of approaches can provide dual insights into N2O emissions and prediction in treatment processes?,Utilizing regression modules under new simulations.,Discrete kinetics calibrated bypassing traditional setups.,Data-driven modeling with molecular dynamics simulation,Coupled CFD analysis and mechanistic modeling methods.
190,What alternative do data-driven models provide in studying N2O processes?,Directly implementing strategies to cut emissions comprehensively onsite.,Configuring system setups to bypass existing updates and limitations.,As embedded tools in strategies balancing multiple criteria in control.,Adjusting chemical content based on hardware for steady changes overall.
191,What is one of the purposes of integrating data-driven methods in wastewater management?,To avoid the adaptation of operational process conditions.,To minimize the overall computational resources required.,To phase out conventional mechanistic simulation techniques.,To identify chances for N2O emissions monitoring and control.
192,What challenge do traditional water utility operations face with AI implementation?,Established simulation methods are no longer functional today.,Implementation is restricted due to legal constraints imposed.,Departments seldom share and unify their analytical processes.,Application frameworks lack complete support for AI systems.
193,What functionality do user-friendly dashboards provide in wastewater management?,To expand variables computed for geometry visualisation tasks.,To identify risks and boost the system's performance levels.,To achieve comprehensive predictions through advanced modeling.,To avoid adopting integrated approaches like SCADA systems.
194,What is a main challenge in accurately modeling the N2O emissions in urban wastewater systems?,The unavailability of methane-related estimation procedures.,Systemic dynamics involving multiple complex generation pathways.,The emission prediction challenges for organic digestion.,Unawareness about pollution due to outdated methodologies.
195,What is considered the limitation of using the IPCC Tier 1 methodology for N2O quantification?,General factors do not reflect specific system conditions.,This method predicts methane emissions inaccurately.,Methodology is constrained by anaerobic categorization.,Temperature adjustments do not influence calculations.
196,What is a critical factor for effective GHG quantification methods in wastewater treatment plants?,Relying solely on real-time grab-based sampling strategies.,Using short-term campaigns for capturing comprehensive patterns.,Implementing in-depth and carefully planned long-term campaigns.,Disregarding seasonal variation in the emission measurements.
197,Why are long-term studies required in GHG quantification in sewer systems?,To reduce reliance on advanced artificial intelligence tools.,As short-term results are sufficient for accurate assessments.,For focusing primarily on non-representative emissions data.,To extensively cover seasonal and operational fluctuations.
198,How might AI-guided monitoring strategies benefit GHG quantification?,Removing the necessity for computational modeling support.,Concentrating entirely on observational data system metrics.,Exclusively employing non-digital flux-based chambers.,Reducing time required for comprehensive emissions modeling.
199,What is the significance of soft sensor development in monitoring systems?,They estimate values of variables indirectly through methods.,Sensors integrate organic nitrogen collection functionalities fully.,These provide accurate real-time sludge measurements directly.,Unified standards for enhanced variable calibration strategies.
200,Why is it challenging to generalize N2O mitigation strategies from one plant to another?,Profiles of aeration cannot be comparatively aligned entirely.,Inherent chemistries of Nitrogen Oxide remain mostly under-discovered.,Fundamental differences among nutrient cycles dominate processes.,"Configurations and processes vary, influencing systems distinctly."
