ID,Question,A,B,C,D
1,What role do wastewater utilities play in the water sector?,They primarily focus on desalination.,They collect and treat generated wastewater to ensure the effluent can be safely discharged or reused.,They distribute bottled water to homes and industries.,They only monitor water purity in natural bodies of water.
2,What main challenges are facing the water sector due to climate change?,Global trade fluctuations,Regulatory changes,"Lack of research, and new technologies","Extreme weather events, frequent floods or prolonged droughts"
3,What has challenged the traditional perception that water and wastewater services should be free?,Emergence of advanced water recycling technologies.,Government regulations ensuring public utilities remain free.,Public support for sustainable and free services.,Increasing water scarcity and environmental pollution in different parts of the world.
4,What sources of energy are utilities encouraged to purchase for immediate emissions reduction?,Green electricity from solar and wind sources,Electricity generated from natural gas,Biofuels made from agricultural waste,Nuclear energy from distant reactors
5,Which process maximizes the recovery of biogas in wastewater treatment utilities?,Photobiological systems,Heat/ pressure recovery,Process intensification using membranes,Anaerobic digestion coupled with biogas capture and utilization technologies
6,What emerging AD alternative explores new pathways for sludge valorization and resource recovery?,Anaerobic membrane bioreactors (AnMBR),Sludge co-digestion,Thermal hydrolysis,Hydrothermal liquefaction (HTL)
7,What is one common oxidation reaction-oriented processes facilitated by MET (microbial electrochemical technology) systems?,CO2 is converted to CH4.,Electrons from organic waste are transferred for denitrification,Organic compounds are receiving electrons from the electrode,Biodegradable substrates are oxidized to generate electrical current.
8,Why is it important to capture and combust methane during anaerobic digestion?,Methane has applications in industrial cooling,Methane has substantial short-term climate impacts,Methane is more difficult to store than CO2,Methane reduces the efficiency of digestion processes
9,Why is the carbon intensity of modern water systems coupled to the carbon intensity of electricity supply?,Because they use natural gas for water treatment.,Because they distribute electricity to residential areas.,Because they use electric power for various purpose such as pumps and blowers.,Because they generate electricity through solar panels.
10,"What factor could substantially increase the demand for hydrogen as a transportation fuel, heating fuel, or chemical process input?",Increasing electricity prices,Lowering oil prices,Increasing natural gas supplies,Enacting a price on carbon emissions
11,What can accelerate decarbonization alongside technology developments?,Policy incentives,Decreased consumer demand,Greater fossil fuel investments,Fewer emissions regulations
12,Which factor primarily led to the decline of coal power well before decarbonization efforts became prevalent?,Improvements in air quality demanded by society,Constant output of nuclear plants,Increased profits from maintaining coal power,Operational advantages of older coal plants
13,What is the characteristic capital turnover rate for wind turbines and solar photovoltaic (PV) facilities?,30-40 years,50+ years,100 years +,About 20 years
14,What characteristic of lithium-ion batteries primarily enabled their use in small electronics?,Lower production cost,Simpler manufacturing process,Longer shelf life,Much higher energy density
15,What is the primary purpose of the urban water cycle?,Facilitate urban development projects,Promote sustainable agriculture,Enhance biodiversity in water bodies,Provide potable drinking water to society
16,What is a major factor contributing to increased energy use in water networks?,Leaks and issues with infrastructure,Advanced water filtration,Increase in demand,Pump efficiency improvements
17,In what conditions do both ammonia-oxidizing bacteria and nitrite-oxidizing bacteria produce N2O?,Anoxic conditions,Aerobic conditions,Ambient conditions,Anaerobic conditions
18,Which advanced water treatment process is noted for being particularly energy intensive?,Mixing,UV disinfection,Filtration,Desalination
19,Which database is specifically mentioned for obtaining published Emission Factors?,The United Nations Global Emission Repository.,The World Resources Institute Database.,The IPCCs 'Emission Factor Database'.,The International Energy Agency Database.
20,What is one limitation of simple comprehensive process models in wastewater treatment plants?,Restricted to steady-state analysis,Restricted to dynamic-state analysis,Limited by constant variable inputs,Incapable of filtering microorganisms
21,"What additional parameters, besides N2O emissions, can improve models in understanding wastewater treatment processes?",Turbidity and viscosity,Conductivity and settling velocity,Humidity and salinity,pH and temperature
22,Which nutrients are recoverable from wastewater in a WRRF?,Methane,Calcium and magnesium,Nitrogen and phosphorus,Rare metals
23,What is the potential benefit of using Anammox for nitrogen removal in wastewater treatment?,It doubles the nitrogen removal efficiency compared to traditional methods.,It eliminates the need for secondary treatment processes entirely.,"It can yield good BOD removal with low MCRT, allowing for energy optimized WRRFs.",It primarily focuses on reducing the operational costs of wastewater treatment.
24,What is a critical aspect of successful carbon capture above conventional levels in wastewater treatment?,Focusing on advanced tertiary treatment methodologies.,Minimizing the residence time of wastewater in treatment facilities.,Implementing stricter regulatory controls on sludge management.,Good design of the high rate process for optimum sludge production and processing of sludge for energy production.
25,Which factor predominantly contributes to N2O production in short cut N pathways processes?,Nitrite formation,Ammonia oxidation,Biomass decay,Organic degradation
26,Which of the following operational strategies is suggested to reduce fugitive methane emissions in a WRRF?,Returning sludge liquor recycles to the activated sludge process,Increasing sludge storage,Enhancing residual methane production,Intensifying anaerobic conditions
27,What is one reason for high specific energy use in small WRRFs without parallel units?,Under-utilization of the design capacity,Inadequate energy supply systems,Lack of modern technology,Shortage of wastewater influent
28,What factor suggests that novel operational and control strategies are needed for small WRRFs?,Excessive staff requirements,Extended maintenance routines,Frequent equipment failures,High specific energy use
29,What will be an important reason for a need of KPIs comparison across various WRRFs?,To balance the operational costs among facilities,To ensure uniform energy consumption across each facility,To set goals for decarbonization in each facility,To standardize resource quality across various facilities
30,What type of WRRFs in the United States have demonstrated energy-neutral wastewater treatment using sidestream AD?,Industrial WRRFs.,Municipal WRRFs that accept external waste for anaerobic co-digestion.,Small-scale WRRFs focusing on complete waste elimination.,WRRFs that do not utilize biogas production.
31,What is a critical factor for enhancing the economic benefits of ACoD?,Maximizing the yield of each individual substrate,Subsidizing the cost of biogas production,Reduction in the transportation distances and storage costs of co-substrates,Ensuring the isolation of substrates during the process
32,Which operational parameter optimization as a goal for the ACoD process?,Pressure levels,Operational time,Energy consumption,Organic loading rate
33,What is one significant challenge of using biogas combustion in boilers for wastewater facilities?,Short equipment lifespan,High operational costs,Loss of process efficiency due to process limitations,Increased water consumption
34,What is one of the primary bottlenecks for the application of pressure swing adsorption (PSA) for biogas purification?,The high capital costs for the PSA addition,The inefficiency of the PSA process,The unavailability of natural gas pipelines,The difficulty in producing CH4
35,What is described as high value building block chemicals produced as byproducts of anaerobic digestion?,Hydrogen sulfide,Ammonia,Methane gas,Volatile fatty acids
36,Which component of traditional activated sludge treatment systems consumes approximately half of the electricity requirements?,Pumping sludge into digesters,Filtering the effluent water,Providing air to the aeration basin,Heating the sludge for digestion
37,What is a principal characteristic of microbial electrochemical technology (MET) that differentiates it from other environmental technologies?,It can only generate electricity.,It does not support the oxidation of biodegradable substrates.,It exclusively reduces CO2 without producing other compounds.,It allows electrodes to serve as both electron acceptor and donor.
38,How do microbial electrolysis cells (MECs) function differently from microbial fuel cells (MFCs)?,MECs produce H2 and other chemicals while MFCs generate electrical current.,MECs operate with microorganisms while MFCs rely solely on chemical reactions.,MECs function as electron donors only while MFCs act solely as electron acceptors.,MECs oxidize substrates without generating any products while MFCs reduce CO2 directly.
39,Which compound can be produced by autoelectrophic bacteria using acetyl-coenzyme A?,sucrose,ribose,glucose,isobutanol
40,Which type of enzymes do chemotropic microbes possess that play a crucial role in CO2 reduction?,Permanent dehydrogenase enzymes,Reversible hydrogenase enzymes,Stable reductase enzymes,Irreversible oxidase enzymes
41,What key factor can be regulated to enhance H2 production in anodic EF?,pH level,Nitrogen concentration,Temperature,Anode potential
42,What recent technological development has allowed the anaerobic digestion (AD) process to be rewired to promote the production of short chain VFAs and alcohols?,Photobioreactor cultivation,Enzymatic hydrolysis,Catalytic hydrogenation,Arrested methanogenesis
43,What facilitates carbonate precipitation in wastewaters from oil and gas produced water and coal-fired power plants?,Increased levels of silicate exclusively.,"High concentrations of metal cations like Ca2+, Mg2+, Na+, Sr2+, and Ba2+.",Exclusive presence of cation sources from seawater.,"Low concentrations of metal cations like Ca2+, Mg2+, Na+, Sr2+, and Ba2+."
44,What must Water Resource Recovery Facilities (WRRFs) consider managing in addition to mainstream nitrogen?,Ammonia fixation technologies,Processes for carbon capture,Sludges generated from mainstream contexts,Nitrogen generated from waste sludges
45,Which process uses anaerobic treatment as an alternative method due to its specific benefits?,Phosphorus removal.,Toxic metal removal.,Nitrogen removal.,Carbon removal.
46,What is considered a way to use influent carbon more efficiently for nitrogen removal?,Extending the aeration SRTs,Utilizing a step-feed process with multiple anoxic zones,Adding another aerobic zone,Increasing influent COD amount
47,What is a necessary condition for Partial denitrification/ anammox (PdNA) to effectively occur?,Integrated PdNA should be done in the same reactor as the biofilm.,Aerobic ammonia oxidation must occur upstream in a separate zone or reactor.,The SRT of the anammox bacteria should be less than the rest of the mixed liquor.,Partial nitritation should happen downstream in the BNR process.
48,What is a significant challenge associated with implementing partial nitrification with anammox (PNA) in nitrogen removal processes?,high supplemental COD requirement,requirement for high alkalinity,NOB out-selection,incomplete TIN removal
49,What is one of the benefits of shortcut nitrogen removal in wastewater treatment plants?,Increased plant capacity through SRT reduction.,Increased nitrogen levels in discharge.,Higher exogenous carbon costs.,Reduced potential for decarbonization.
50,Which process is argued to immediately benefit mainstream situations where low TN limits are required?,Partial denitrification/ anammox (PdNA),NOB out-selection,complete nitrification,nitrite shunt
51,Which of the following is NOT an example of a stormwater control measure used for managing urban runoff?,Constructed wetlands,Infiltration beds,Retention basins,Industrial waste recycling facilities
52,Which program or initiative is associated with reducing urban runoff and its impact on water quality in the United States?,Sustainable Urban Drainage Systems,Eco-Urbanization Projects,Low Impact Development,Sponge Cities
53,What is one of the drawbacks of implementing on-site primary sludge fermentation in EBPR systems?,potential odors from fermenter,inconsistent nutrient absorption,increased risk of chemical contamination,decreased biological activity
54,What is a primary benefit of employing the Sidestream Enhanced Biological Phosphorus Removal (S2EBPR) process over conventional methods?,Greater reliance on influent carbon loads,Improved P removal and recovery performance without external carbon supplement,Reduced denitrification capability,Increased daily sludge production
55,"Which of the following phosphorus recovery processes is noted for generating less emissions and requiring lower energy demands, but offers lower rates of recovery?",Thermal solubilization of phosphates,Recovery from the liquid phase,Recovery from sludge ash,Chemical recovery through acid attack
56,"Which component in constructed wetlands (CW) systems is crucial for improving nutrient removal performance, particularly phosphorus (P)?",Specialized substrates with conducive physico-chemical properties,Higher operational energy demands,Limited CH4 and N2O emissions,Increased greenhouse gas emissions
57,Which process notably reduces biosolid production and avoids the creation of chemical sludge in wastewater treatment?,EBPR process,Primary treatment,Gravity-based separation,Tertiary treatment
58,What is the primary source of energy for Purple Phototrophic Bacteria growth under phototrophic mode?,Oxidative phosphorylation,Degradation of organic compounds,Light energy (solar radiation),Absorption of oxygen
59,Which metabolic pathway is employed by Purple Phototrophic Bacteria for carbon fixation via CO2?,Embden-Meyerhof pathway,Tricarboxylic acid cycle,Pentose phosphate route,Calvin-Benson-Bassham cycle
60,What feature of the photobioreactor configuration contributes to the higher treatment capacities during the central hours of the day?,Higher algae biomass production in aerobic conditions.,Moderate environmental loading rates.,The use of multiple channels in the configuration.,Sunlight strikes perpendicularly to the cultivation surface.
61,Which configurations are documented for the continuous treatment of wastewater in photobioreactors?,Vertical and horizontal systems,Radial and axial systems,Cylindrical and conical systems,Spiral and cascade systems
62,From which type of substrates can biogas be generated due to the versatility of anaerobic digestion?,Only primary and secondary sludge from WWT plants.,"Agricultural residues, animal manure, energy crops, micro and microalgae, and even PPB.",Inorganic waste materials and metals.,Petroleum and synthetic organic compounds.
63,What is one of the main advantages of using enzymatic methods for cell lysis?,They generate high amounts of inhibitory by-products.,They perform cell lysis under high pressure conditions.,They perform cell lysis without generating inhibitory side-products.,They require a high energy demand.
64,Why is anaerobic digestion recommended only when alternative Purple Phototrophic Bacteria (PPB) valorization strategies are not feasible?,Due to rapid depletion of biomass,Due to high emissions of greenhouse gases,Due to insufficient waste water supply,Due to relatively low economic profits from biogas and low digestibility of PPB
65,What operational strategy was validated under semi-industrial scale to ensure consistent biomethane quality?,Optimization of the L/G ratio,Altering the photobioreactor illumination,Adjustment of the scrubbing liquid pH,Regulating the CO2 injector settings
66,How do recovered energy and nutrients from sludge benefit utilities?,They help utilities avoid government penalties,They generate revenue and contribute to carbon emission reductions,They reduce the cost of water supply treatment,They minimize the need for backup power systems
67,What is a notable ecological benefit of AD in biosolids management?,Eliminates the need for sludge processing,Consumes all residual biogas,High extraction efficiency of organic energy,Reduces nitrogen emissions completely
68,What is a key disadvantage of using raw process water from Hydrothermal Liquefaction (HTL)  technology?,It is highly corrosive to equipment.,It lacks essential nutrients.,It has a high concentration of toxic compounds.,It is too dilute for effective use.
69,What process is essential when applying biosolids to brownfields to maximize organic content and minimize potential nitrate loss?,Balancing the carbon to nitrogen ratio,Monitoring soil pH levels,Adding synthetic fertilizers regularly,Ensuring adequate sunlight exposure
70,What is one significant limitation of most conventional wastewater treatment operations regarding emerging contaminants (ECs)?,Produced high sludge volume with no ECs.,Removed all hormones and antibiotics efficiently.,Transformed ECs into non-toxic substances.,Limited capability to entirely remove emerging contaminants.
71,Which method is primarily used to address multiple and often conflicting criteria in sustainable sludge management?,LCA and LCCA analysis combination,Multicriteria decision-making (MCDM) method,Techno-economic analysis (TEA),"Strengths, weaknesses, opportunities, threats (SWOT) analysis"
72,What must be included in a detailed analysis of essential components for municipal sludge disposal?,"Economic, public, and operational aspects only",Technical and public aspects only,Local and operational aspects only,"Regulatory, local, public, economic, operational, and technical aspects"
73,What disadvantage is associated with conventional activated sludge (CAS) treatment in wastewater treatment plants?,"It utilizes an excessively large footprint, causing land use issues.",It is extremely expensive and has high operation costs.,It cannot handle a wide range of molecular weights in wastewater.,It poorly removes emerging micro-pollutants in wastewater.
74,Which species of bacteria has been reported to create favorable conditions for the growth of Chlorella vulgaris in algae-sludge MBR systems?,Escherichia coli,Staphylococcus aureus,Clostridium perfringens,Bacillus licheniformis
75,What primary benefit does mainstream anaerobic treatment provide in comparison to aerobic systems?,It requires less aeration equipment.,It reduces methane production.,It eliminates aeration for biomass.,It decreases anaerobic decomposition.
76,What aspect of Membrane Biofilm Reactors (MBfRs) contributes to its sustainability in water treatment?,Incorporates heavy metals to enhance microbial activity.,Exploits natural sunlight for microbial growth.,Limits the release of volatile organic compounds (VOCs) from the bioreactors.,Uses non-biodegradable chemicals to treat wastewater.
77,What is the role of aeration in the hybrid forward osmosis membrane bioreactor membrane distillation (FOMBR-MD) system?,It carries nonvolatile substances out of the solution.,It increases the pressure within the bioreactor.,It supplies oxygen to the biomass and scours the FO membrane.,It decreases the salinity of the feed solution.
78,What is necessary for efficient and economical osmotic power generation during high-pressure operation in Pressure retarded osmosis (PRO) systems?,A support layer with high mechanical strength,A membrane with high surface roughness,A membrane with low porosity,A support layer with high thermal conductivity
79,Why is membrane distillation (MD) particularly preferred when solar energy and waste heat are available?,MD operates efficiently without any thermal energy input.,MD requires high-pressure pumps to push water through membranes.,MD can utilize waste heat and solar energy as thermal energy for desalination.,MD depends on chemical additives to separate salts from water.
80,What benefit does biochar provide when used as a soil additive?,Increases water and nutrient capacity of the soil,Increases pest resistance of plants,Promotes faster root growth,Reduces soil alkalinity
81,What are the major benefits of Natural Treatment Systems (NTS) over conventional treatment infrastructure?,NTS require high capital and operational investment.,"NTS systems are simpler, more cost-effective, efficient, and reliable.",NTS are only effective in urban and industrial areas.,NTS are highly dependent on specialized equipment and skilled workers.
82,What role does highly porous activated carbon play in the biological filtration process for stormwater treatment?,Increasing the salinity of the water,Promoting the growth of pathogenic bacteria,Removing organic compounds and low concentrations of heavy metals,Reducing the pH of the water
83,How do microorganisms contribute to the biofiltration process?,By reducing the turbidity of the water,By forming biofilms on the media and consuming or sequestering contaminants,By increasing the temperature of the water,By converting contaminants into oxygen
84,What is one method that most water utilities use to reduce their carbon footprints?,Electrifying pumping and other operations with solar power and battery storage,Using coal-powered generators,Relying solely on hydroelectric power,Expanding natural gas pipelines
85,What potential advantage does microalgal cultivation have compared to terrestrial plants in wastewater treatment?,Accelerated rate of operation,Better soil compatibility,Lower maintenance cost,More aesthetic appeal
86,What is the purpose of using small-scale distributed water treatment facilities and wastewater treatment plants in conjunction with the One-Water concept?,They manage emergent pollutants purely based on seasonal variations.,They continuously monitor the state of the system to improve water quality and conserve water.,They selectively target specific pollutants for removal.,They are used mainly for aesthetic improvements to wastewater systems.
87,What is the primary role of hydrogenotrophic methanogens in anaerobic digestion?,Degrade organic matter in the presence of free oxygen.,Produce H2 through the breakdown of CO2 and CH4.,Convert CO2 to CH4 by utilizing H2 produced by acetogenesis.,Support acetoclastic methanogens in methane production.
88,Which pathways determine methane (CH4) production in anaerobic digestion?,Acetoclastic methanogenesis only,Hydrogenotropic methanogensis only,Acetoclastic and hydrogenotrophic methanogensis,Acetogenesis
89,Which microorganism type is primarily involved in the anaerobic conversion of organic substrates for methane production?,Methylotrophs,Methanogens,Purple sulfur bacteria,Acetogens
90,"Compared to anaerobic methanogenesis, how does electromethanogenesis benefit system stability?",By eliminating the need for methane production regionally,By reducing the need for electrosynthetic microorganisms,By producing hydrogen directly from CO2,By having more diverse carbon conversion routes due to electrochemical processes
91,Which method is commonly used to mechanically break the cell wall in pretreatment processes of anaerobic digestion?,The ultrasonic technique,Biological fermentation,Physical agitation,Electrochemical oxidation
92,What critical role do hydrogenotrophic methanogens play in anaerobic digestion of waste activated sludge?,Producing organic acids from glucose,Acting as the primary fermentative species,Oxidizing NADH into NAD+,Utilizing H2 as an electron donor and CO2 as an electron acceptor
93,What role do microbial communities with the ability of extracellular electron transfer play in electrochemically enhanced AD reactors?,They degrade carbon directly without intermediates,They replace the function of fermentative bacteria and methanogens,They inhibit the process of methanogenesis entirely,They act as a bridge connection to fermentative bacteria and methanogens
94,Why are heat pumps more efficient than combustion-based heating systems?,They convert mechanical energy directly into heat.,They transfer thermal energy from a source to a sink.,They use solar panels for energy.,They generate heat from a primary energy source.
95,Why are heat pump-based systems preferred over electrical resistance heating?,They are less efficient in heat production,They reduce the burden of electrical energy consumption,They are less expensive to install,They reduce the need for district heating
96,How does wastewater temperature change as it travels longer distances within the sewer?,It becomes significantly colder than the ambient winter air temperature.,It cools down to match the outdoor air temperature.,It heats up due to increased friction.,It approaches the ground temperature of the surrounding soil.
97,What viable means can be used to reduce indoor heating-related emissions?,Focusing on individual building insulation improvements only,Relying solely on renewable electricity,Incorporating low-grade thermal energy sources into connected systems,Utilizing high-grade energy sources exclusively
